{
  "proposal_id": "PROP-DEMO-001",
  "iteration_id": "ITER-DEMO-001",
  "target_skill": "renwork-growth-os-kb",
  "change_type": "patch",
  "motivating_pattern_ids": ["PAT-BASE-003"],
  "source_trace_ids": ["TR-DEMO-001"],
  "diff_sha256": "0123456789abcdef0123456789abcdef0123456789abcdef0123456789abcdef",
  "created_at": "2026-08-30T12:10:00Z",
  "created_by": "example-proposer",
  "status": "candidate"
}
